conv_id,speaker_utterance,Test2.1_response_GPT4,Test2.2_response_GPT4
hit:9204_conv:18409,I really like summer time and going to the beach,That sounds wonderful! What do you enjoy most about going to the beach during the summer?,That sounds great! What do you enjoy most about going to the beach during summer?
hit:8358_conv:16717,I hired a tree guy to trim some really high branches. He monkeyed up that tree super fast! It was amazing to watch!,"Wow, that sounds incredible! It must have been quite a sight to see someone so skilled at work. I'm glad you found someone so capable for the job!","Wow, that sounds impressive! It must have taken a lot of skill and courage to climb that high. Did he manage to get all the branches you needed trimmed?"
hit:8257_conv:16514,I dropped a bowl of mashed potatoes and it smashed all over the floor,"Oh no, I'm really sorry to hear that! It's always frustrating when accidents like that happen, especially when it’s something you've put effort into making. If you need any help cleaning it up or making more, I’m here for you.","Oh no, that must have been frustrating! Are you okay? Do you need any help cleaning it up?"
hit:7923_conv:15847,"I'm disappointed in my new car, it has already broken down twice and now it's in the shop!","Oh no, that sounds really frustrating, especially since it’s a new car. Have they given you any idea of what the issue might be? Hopefully, they can sort it out quickly so you don’t have to deal with any more disruptions.","Oh no, that sounds really frustrating! It's such a hassle dealing with car issues, especially with a new one. Have you spoken to the dealership about it? Maybe they can offer a solution or help in some way."
hit:8092_conv:16184,"I just found out a few days ago that my new employer is fantastic, as far as working with my schedule. I will have all the time I need to balance work, school, and family time.",That's wonderful to hear! It must be such a relief to know that your new job supports the balance you need in your life. It sounds like this change has turned out to be a great decision for you. How are you feeling about everything now?,That's wonderful news! It must be such a relief to know you can manage all those important parts of your life without too much stress. How are you planning to use the extra time you'll have?
hit:6541_conv:13082,I got a new laptop pretty recently. Blown away by the performance difference from my old one,That's fantastic! What kind of tasks are you finding it handles better than your old one?,"That's awesome! What kind of laptop did you get, and what are you enjoying most about the performance upgrade?"
hit:7930_conv:15861,This morning I was organizing some old boxes and I found pictures of me and my friends during our high school years,That must have brought back so many memories! It's always a bittersweet feeling to look back at those times. What was one of your favorite moments from back then?,That sounds like a fun trip down memory lane! Did finding those pictures bring back any special memories?
hit:10825_conv:21651,I won a 10k race on the weekend,That's amazing! Your dedication and hard work really paid off. Congratulations on your victory!,That's awesome! Congratulations on winning! How did you feel during the race?
hit:6592_conv:13184,I hate having to call the cable company. They always make me so mad!,"I completely understand why you're feeling that way. It sounds incredibly frustrating to deal with being transferred and hung up on, especially when you're just trying to get some help. What were you calling them about? Maybe there's another way to resolve the issue.","I totally get that, dealing with customer service can be really frustrating. Have you considered using their online chat options? Sometimes that can be a bit less stressful."
hit:7074_conv:14148,My kid had his first football game today!,"Wow, that's fantastic! How did it go?",That's exciting! How did it go?
hit:9454_conv:18908,"I was working the other day and my supervisor comes up to me out of nowhere, calls the entire department over and just started yelling at me for about an hour.","Wow, that sounds incredibly stressful and humiliating. It's completely understandable why you'd be furious about being treated that way. Have you had a chance to express how this made you feel to your supervisor or HR? It’s important that your side is heard, especially in such a public situation.",That sounds really stressful. It must have been tough to be in that situation. How did you handle it?
hit:8148_conv:16297,No one's at the office. Never been alone here before.,"That sounds quite isolating. If you'd like some company, we could chat over the phone or video call. What do you think?","That must feel a bit strange! Do you enjoy the peace and quiet, or does it feel too eerie?"
hit:7144_conv:14289,After he gave me the car I couldn't believe it,"Wow, that’s incredibly generous! It must feel amazing to have such a thoughtful friend. How are you planning to thank him?","Wow, that sounds amazing! What kind of car is it?"
hit:8676_conv:17352,"I just bought a battery pack charger for my car, and guess what happened to me today.","Oh wow, what happened? It sounds like you were ready for anything with that new battery pack charger!",What happened? Did something go wrong with it?
hit:9415_conv:18830,Really sick of going through the same thing with a person who is in my life.,"I can hear the frustration in your voice. It must be really tough dealing with the same issues repeatedly, especially when it involves dishonesty. What's been happening?",I'm sorry to hear that you're feeling this way. It must be really frustrating to deal with repetitive issues. Want to talk more about what's been happening?
hit:3351_conv:6702,I'm on a week long vacation from work,That sounds wonderful! It must be so nice to have some time to relax and unwind. What have you been up to during your vacation?,That sounds awesome! Do you have any special plans for your vacation?
hit:5127_conv:10255,Our home was broken into recently.,I'm so sorry to hear that happened to you. It must have been really scary. Are you all okay now? How have you been managing since then?,I'm so sorry to hear that. Are you and your family okay?
hit:8483_conv:16966,I was mad the other night when my check engine soon light came on. It was just in the shop too,"That sounds incredibly frustrating, especially after you just had it checked. Have you been able to speak with the mechanic about what might have gone wrong so soon after the service?","That sounds really frustrating, especially just after having it in the shop. Have you been able to find out what's causing the light to come on this time?"
hit:9612_conv:19225,I came home from grocery shopping to find that my husband had cleaned the entire house up and started dinner. I was amazed.,"Wow, that's fantastic! It must have been such a wonderful surprise to walk into a clean home and smell dinner cooking. He really went above and beyond!",That sounds wonderful! It must have been such a nice surprise to come home to a clean house and dinner already being made. How did the rest of your evening go?
hit:5281_conv:10562,"A man punched me on the subway last week, now I'm terrified to leave my house.","I'm so sorry to hear that happened to you. It's completely understandable to feel scared after such a traumatic experience. If you need someone to talk to or if there's anything I can do to help you feel safer, please let me know. Maybe we can think of some steps together to help you regain your confidence when you're ready.","I'm really sorry to hear that happened to you. It must have been a very scary experience. Have you been able to talk to someone about it, like a friend or a professional? It's important to take care of yourself after such a traumatic event."
hit:2684_conv:5369,I love by myself and it gets so boring.  Its just me and my dog.,"I can understand how that might feel lonely at times. It's good that you have your dog for company, but maybe we could think of some activities or hobbies you could pick up to make things a bit more lively. How about we plan a day to hang out soon? Maybe you could bring your dog along too!",It sounds like it can get pretty quiet living alone. Dogs are great companions though! Have you considered joining any local clubs or classes that might interest you? It can be a good way to meet people and break up the monotony.
hit:7548_conv:15096,I should have spent more time with my partner practicing her driving skills. She failed driving test for the second time already,"I understand why you might feel that way, but it's important not to be too hard on yourself. It's great that you want to support your partner, and perhaps moving forward, you could plan more practice sessions together. Remember, her passing the test is also dependent on many factors, including her own nerves and the conditions on the test day. What matters most is that you're there for her now and can help her prepare for the next attempt.","Oh no, that's really tough for her. Maybe you could plan a few practice sessions together each week? It might help her feel more confident next time she takes the test."
hit:5385_conv:10770,On my 29th birthday my wife invited all my friends without me knowing,"Wow, that must have been quite the surprise! How did you feel when you saw everyone there?",That sounds like an amazing surprise! How did you feel when you saw everyone?
hit:2964_conv:5929,I was driving in a parking lot and someone stole my parking spot.,"Oh, that's incredibly frustrating! It's so annoying when someone just swoops in like that. What happened next? Did you manage to find another spot?","Oh no, that must have been really frustrating! Did you end up finding another spot nearby?"
hit:9032_conv:18064,"I got a ""thank you"" card sent to me from a co-worker in a different department for helping them.",That's wonderful! It must feel great to be appreciated like that for your efforts. It really shows how much your help meant to them.,That was really thoughtful of them! It must have felt great to be appreciated like that. What did you help them with?
hit:1151_conv:2303,Im feeling pretty good today. ,That's wonderful to hear! It sounds like things are going really well at work for you. What's been making you feel so good today?,That's great to hear! What's made your day so good?
hit:2899_conv:5799,I was expecting a delivery today but the mailman did not come.  ,"That's really frustrating, especially after waiting all day. Is there a way to check the tracking status or reschedule the delivery?","Oh no, that's frustrating! Is it possible to track the package online to see its current status? Maybe that could give you some more information."
hit:9611_conv:19222,I have been tutoring my nephew in math. He brought back an A on his last test. I am so happy for him.,That's fantastic news! Your hard work and dedication really paid off. You must be so proud of him! How does he feel about his achievement?,That's fantastic! You must be a great tutor. It’s so rewarding to see your efforts paying off. How is your nephew feeling about his achievement?
hit:11778_conv:23556,I love my wife so much!,That's wonderful to hear! It's clear how much you cherish your relationship.,That's wonderful to hear! What do you love most about her?
hit:8324_conv:16648,I should be receiving a bonus for how well I have been doing at work. ,"That's fantastic news! It sounds like you've worked really hard, and I hope you get the bonus you deserve. Fingers crossed for you!",That's great to hear that you've been doing so well! Have you had a chance to discuss your performance and the possibility of a bonus with your manager?
hit:9787_conv:19575,I left some bread in the fridge too long and it got all moldy,"Oh no, that sounds really gross! Moldy bread is definitely not a pleasant surprise. Have you managed to clean it out yet?","Oh no, that's unfortunate! Have you had a chance to clean it out yet? Mold can spread pretty quickly."
hit:7425_conv:14850,My husband took our girls on a father-daddy day trip the other day.,That must have been really quiet at home without them all. Did you find yourself missing the usual hustle and bustle?,That sounds lovely! Where did they go?
hit:3920_conv:7840,MY daughter told me she wants toplay bass guitar.,"Wow, that’s unexpected! What made her interested in the bass guitar?","That's awesome! Has she started looking into bass guitars, or is she thinking about taking lessons?"
hit:9720_conv:19441,I went on my first roller coaster last month! I was scared out of my mind and was sweating bullets!,"Wow, that sounds like it was quite an intense experience for you! How did you feel once it was all over?","Wow, that sounds intense! How did you feel once you got off the ride?"
hit:4038_conv:8077,Recently my 18 month old has started repeating words so much more clearly.... makes me so happy!,"That's wonderful to hear! It must be so rewarding to see your little one's communication skills blossoming. They grow up so fast, don't they? You must be very proud!",That's wonderful to hear! It must be so exciting to watch your little one's language skills blossom like that. What are some of the words they've been saying?
hit:7116_conv:14233,I really feel bad I didn't refill my mother's car with gas.,"It's understandable that you feel that way, but it's great that you recognize your oversight. Maybe you can offer to fill it up next time or do something else thoughtful for her. Mistakes happen, and the important thing is how we handle them afterward.",It's understandable to feel bad about that. Maybe you can make it up to her by refilling it next time or doing something else thoughtful for her.
